{
  "budget": [
    "当初予算額",
    "補正予算額",
    "継続費及び繰越事業費繰越額",
    "予備費支出及び流用増減",
    "計"
  ],
  "executed": [
    "支出済額",
    "継続費逓次繰越",
    "繰越明許費",
    "事故繰越し",
    "不用額"
  ],
  "page_width": 595.32,
  "body_top": 112,
  "body_bottom": 800,
  "label_right": 125,
  "amount_left": 125,
  "amount_right": 497,
  "section_left": 495,
  "section_right": 575,
  "right_amounts_right": 1033.3,
  "note_left": 1035,
  "note_rule_left": 440,
  "note_rule_right": 568
}
